{
  "id": "core:mandrake_bulb",
  "tags": [
    "land",
    "harvest",
    "control"
  ],
  "activation": {
    "damage": 12,
    "range": 1000,
    "cooldownTicks": 30,
    "shape": "projectile",
    "knockback": 30,
    "form": "단단한 구근이 적 사이를 튕긴다",
    "damageCoefficient": 0.65
  },
  "growth": {
    "target": "land",
    "yield": 1,
    "output": "수확할 때 비명을 내는 작물",
    "primaryRoute": "combat"
  },
  "antiSynergy": [
    "core:shepherd_staff",
    "core:salt_spreader"
  ],
  "name": "만드라고라 구근",
  "concept": "발동: 단단한 구근이 적 사이를 튕긴다. 성장 산출: 수확할 때 비명을 내는 작물. 비용: 익기 전에는 성장 면의 군중 제어를 사용할 수 없다.",
  "designStatus": "candidate",
  "implementationNote": "S3 설계 후보. 고유 효과와 임시 수치·피해 계수는 시뮬레이션에 구현되지 않았으며 측정된 균형값이 아니다.",
  "loopLinks": [
    {
      "estateId": "core:sprout_march",
      "stage": "harvest",
      "reason": "잠정 순환 연결: 성숙 산물을 회수·가공·운반하여 경험치나 판 안 금화로 돌리는 경로를 제안한다. 연결 산출: 수확할 때 비명을 내는 작물. 비용: 익기 전에는 성장 면의 군중 제어를 사용할 수 없다."
    }
  ],
  "floorRationale": "발동 형태: 단단한 구근이 적 사이를 튕긴다. 비교 기준: 같은 발사 간격과 유효 명중 수의 투사체 무기. 직접 발동 피해 계수 0.65는 제안일 뿐 실측 DPS 비율이 아니다. 성장 산출(수확할 때 비명을 내는 작물) 및 제어 기여는 바닥값 피해에 합산하지 않는다.",
  "antiSynergyNotes": [
    {
      "otherId": "core:shepherd_staff",
      "reason": "방목 양이 익지 않은 구근을 먹어 양털 수입과 비명 수확이 경쟁한다. S3 설계상의 비용이며 아직 효과 구현을 검증하지 않았다."
    },
    {
      "otherId": "core:salt_spreader",
      "reason": "소금띠가 구근 성장을 늦춰 즉시 방어와 후속 수확이 경쟁한다. S3 설계상의 비용이며 아직 효과 구현을 검증하지 않았다."
    }
  ]
}
