{
  "id": "core:rain_chime",
  "tags": [
    "building",
    "people",
    "growth"
  ],
  "activation": {
    "damage": 12,
    "range": 1000,
    "cooldownTicks": 30,
    "shape": "projectile",
    "knockback": 30,
    "form": "풍경의 물방울이 적 사이로 연쇄 튄다",
    "damageCoefficient": 0.65
  },
  "growth": {
    "target": "building",
    "yield": 1,
    "output": "저수조 곁 급수 일꾼의 물 배분",
    "primaryRoute": "buff"
  },
  "antiSynergy": [],
  "name": "빗물 풍경",
  "concept": "발동: 풍경의 물방울이 적 사이로 연쇄 튄다. 성장 산출: 저수조 곁 급수 일꾼의 물 배분. 비용: 급수 인원과 저수량을 다른 시설과 나눈다.",
  "designStatus": "candidate",
  "implementationNote": "S3 설계 후보. 고유 효과와 임시 수치·피해 계수는 시뮬레이션에 구현되지 않았으며 측정된 균형값이 아니다.",
  "loopLinks": [
    {
      "estateId": "core:meadow",
      "stage": "growth",
      "reason": "잠정 순환 연결: 식물이 자라거나 손실 후 다시 성장할 수 있는 조건을 제공한다. 연결 산출: 저수조 곁 급수 일꾼의 물 배분. 비용: 급수 인원과 저수량을 다른 시설과 나눈다."
    }
  ],
  "floorRationale": "발동 형태: 풍경의 물방울이 적 사이로 연쇄 튄다. 비교 기준: 같은 발사 간격과 유효 명중 수의 투사체 무기. 직접 발동 피해 계수 0.65는 제안일 뿐 실측 DPS 비율이 아니다. 성장 산출(저수조 곁 급수 일꾼의 물 배분) 및 제어 기여는 바닥값 피해에 합산하지 않는다.",
  "antiSynergyNotes": []
}
